titulo,descricao,data_criacao,data_finalizacao
"Reunião de Planejamento","Reunião com a equipe para planejar o próximo sprint","2024-10-01 09:00:00","2024-10-01 10:00:00"
"Desenvolver Página Inicial","Desenvolver e testar a página inicial do site","2024-10-02 14:00:00","2024-10-03 18:00:00"
"Revisão de Código","Revisar o código do módulo de autenticação","2024-10-04 15:00:00","2024-10-04 17:00:00"
"Apresentação para Cliente","Preparar e realizar apresentação de status para o cliente","2024-10-05 11:00:00","2024-10-05 12:30:00"
"Atualizar Documentação","Atualizar a documentação do projeto com as últimas mudanças","2024-10-06 10:00:00","2024-10-06 12:00:00"
